{
  "$schema": "../../schemas/canonical-acceptance.schema.json",
  "capabilityId": "PC-03",
  "candidateChecksum": "sha256:42241b023cb801b5250569d05efb2d425fead6f32983d0310a0221594445bb0e",
  "decision": "ACCEPTED",
  "reviewer": "PROJECT_OWNER / KNOWLEDGE_GOVERNANCE_AUTHORITY",
  "reviewedAt": "2026-09-24",
  "notes": "M2-FACTORY-CLOSURE C6 · canonical baseline accepted under the instruction's authorization because no genuine semantic ambiguity remains (0 ambiguous IDs; K4 closure, counts and provenance verified literally). ROLE_ONLY: no personal identity recorded or fabricated. Decision set M2-FACTORY-CLOSURE applied."
}
