{
  "$schema": "../../schemas/canonical-acceptance.schema.json",
  "capabilityId": "OP-03",
  "candidateChecksum": "sha256:e04aa3a7dceb596fd5b63027065b865b53c8d38fd0e09a24307c367de4a4d022",
  "decision": "ACCEPTED",
  "reviewer": "PROJECT_OWNER / KNOWLEDGE_GOVERNANCE_AUTHORITY",
  "reviewedAt": "2026-09-24",
  "notes": "M2-BATCH-02 A6 · human governance acceptance of the source-supported canonical baseline, subject to deterministic source integrity, runtime compatibility, fixture certification and publication gates. ROLE_ONLY: no personal identity recorded or fabricated. Decision set M2-BATCH-02 (governance-decisions.json) applied."
}
