{
  "$schema": "../../schemas/canonical-acceptance.schema.json",
  "capabilityId": "DT-02",
  "candidateChecksum": "sha256:8c133a5defadfac8c438b38ac51dbad16c7b9f83342111e4ca7060bfb571e1fb",
  "decision": "ACCEPTED",
  "reviewer": "PROJECT_OWNER / KNOWLEDGE_GOVERNANCE_AUTHORITY",
  "reviewedAt": "2026-09-24",
  "notes": "M2-FINAL-MASS-BATCH · canonical baseline accepted under the instruction's authorization: 0 ambiguous IDs, explicit final K4 closure, CE/VA counts verified literally against declared totals. ROLE_ONLY: no personal identity recorded or fabricated."
}
